id,conversation_id,created_at,date,time,timezone,user_id,username,name,place,tweet,mentions,urls,photos,replies_count,retweets_count,likes_count,hashtags,cashtags,link,retweet,quote_url,video,near,geo,source,user_rt_id,user_rt,retweet_id,reply_to,retweet_date
1139100078331895808,1139100078331895808,1560417596000,2019-06-13,04:19:56,CDT,621868564,jneticsuk,Jnetics,,"When Hayley Minn was 23, she found out she had an 85% chance of getting breast cancer as she was carrying the BRCA gene. Read about her decision to have a life-saving boob job, featured on BBC News today.  #BRCA #Hereditarycancer #Mastectomy #healthcare https://www.bbc.co.uk/news/newsbeat-48313672 …",[],['https://www.bbc.co.uk/news/newsbeat-48313672'],[],6,4,5,"['#brca', '#hereditarycancer', '#mastectomy', '#healthcare']",[],https://twitter.com/JneticsUK/status/1139100078331895808,False,,0,,,,,,,"[{'user_id': '621868564', 'username': 'JneticsUK'}]",
1138813418444546049,1138813418444546049,1560349251000,2019-06-12,09:20:51,CDT,2897535041,esmailjoan,Dr. Joan Antunes,,So I getter tested for the BRCA gene because my mom had breast cancer at 47. Apparently in order for my insurance to cover the test I have to meet with a genetic counselor to determine if I’m eligible for the test. I just want to be proactive!,[],[],[],0,0,1,[],[],https://twitter.com/EsmailJoan/status/1138813418444546049,False,,0,,,,,,,"[{'user_id': '2897535041', 'username': 'EsmailJoan'}]",
1137765000653750272,1137100279894224896,1560099289000,2019-06-09,11:54:49,CDT,786687282497613824,jadentowe,🌸Jaden Towe🌸,,It can cause it if you have the BRCA 1 gene for breast cancer. Which is why people with a history of breast cancer should be tested for it BEFORE they get cancer.,"['piece_goods', 'lilagracerose', 'aoc']",[],[],0,0,0,[],[],https://twitter.com/JadenTowe/status/1137765000653750272,False,,0,,,,,,,"[{'user_id': '786687282497613824', 'username': 'JadenTowe'}, {'user_id': '727973004601372675', 'username': 'piece_goods'}, {'user_id': '70468535', 'username': 'LilaGraceRose'}, {'user_id': '138203134', 'username': 'AOC'}]",
1137764134324441088,1137100279894224896,1560099082000,2019-06-09,11:51:22,CDT,786687282497613824,jadentowe,🌸Jaden Towe🌸,,"They can also PREVENT cancer for anyone with the BRCA 2 gene for breast cancer/ovarian cancer. The fewer periods someone with that gene has, the less likely they are to develope ovarian cancer. The BRCA 1 gene is more dangerous with birth control and is what you are mentioning.","['lilagracerose', 'aoc']",[],[],1,0,1,[],[],https://twitter.com/JadenTowe/status/1137764134324441088,False,,0,,,,,,,"[{'user_id': '786687282497613824', 'username': 'JadenTowe'}, {'user_id': '70468535', 'username': 'LilaGraceRose'}, {'user_id': '138203134', 'username': 'AOC'}]",
1137341857694982144,1137320926780022784,1559998404000,2019-06-08,07:53:24,CDT,2780395189,treda10,Fenia Petran,,"Currently, the BRCA gene test isn't routinely performed on women at average risk of breast and ovarian cancers, but only to people who are likely to have an inherited mutation based on personal or family history, or who have a specific type of breast cancer.",['thenci'],[],[],0,0,0,[],[],https://twitter.com/treda10/status/1137341857694982144,False,,0,,,,,,,"[{'user_id': '2780395189', 'username': 'treda10'}, {'user_id': '38530021', 'username': 'theNCI'}]",
1137341729068257286,1137320926780022784,1559998373000,2019-06-08,07:52:53,CDT,2780395189,treda10,Fenia Petran,,The BRCA gene test is a genetic blood test that uses DNA analysis to identify mutations in either one of the two breast cancer susceptibility genes — BRCA1 and BRCA2.,['thenci'],[],[],0,0,0,[],[],https://twitter.com/treda10/status/1137341729068257286,False,,0,,,,,,,"[{'user_id': '2780395189', 'username': 'treda10'}, {'user_id': '38530021', 'username': 'theNCI'}]",
1136392049702387715,1136351371748368384,1559771952000,2019-06-05,16:59:12,CDT,107415147,jasondanieley,Jason Danieley,,"Yeah, there’s a direct gene correlation called BRCA 1 & 2 gene mutation. But having the gene mutation doesn’t necessarily mean you will get ovarian or breast cancer. But it will help oncologists in knowing what treatments are available to you.",['ronda21080'],[],[],0,0,1,[],[],https://twitter.com/JasonDanieley/status/1136392049702387715,False,,0,,,,,,,"[{'user_id': '107415147', 'username': 'JasonDanieley'}, {'user_id': '36775288', 'username': 'ronda21080'}]",
1136330754630328320,1136298070633852930,1559757338000,2019-06-05,12:55:38,CDT,589303512,abbyknits2,Abby,,I had both ovaries removed 6 years ago to reduce my risk for breast cancer (because of a BRCA gene mutation) and I’ve been on estrogen ever since for the brain and cardiovascular benefits. Ah aging. Love it.,['katiek_wanders'],[],[],0,0,2,[],[],https://twitter.com/AbbyKnits2/status/1136330754630328320,False,,0,,,,,,,"[{'user_id': '589303512', 'username': 'AbbyKnits2'}, {'user_id': '369130606', 'username': 'katiek_wanders'}]",
1135582371766398977,1135375062931038209,1559578910000,2019-06-03,11:21:50,CDT,1072771680680869888,ikyw_trouble,Eevee's on a break,,"From a health science perspective, I’m curious. Breast cancer runs in her family, so why would she get implants, which make cancer harder to detect? Does she carry the BRCA gene and had a prophylactic mastectomy+reconstruction? However, I’m not her doctor, so it’s not my place 🤷🏼‍♀️",['lookkwhat'],[],[],0,0,0,[],[],https://twitter.com/IKYW_trouble/status/1135582371766398977,False,,0,,,,,,,"[{'user_id': '1072771680680869888', 'username': 'IKYW_trouble'}, {'user_id': '900953386320748544', 'username': 'lookkwhat'}]",
1135574335912128514,1135574335912128514,1559576994000,2019-06-03,10:49:54,CDT,160983113,courtreagan,Courtney Reagan,,"Thanks to @megtirrell interview with @AstraZeneca CEO Pascal Soriot...I now know some fraction of pancreatic cancer patients carry the BRCA gene, mostly associated with ovarian/breast cancer. Good to know! #ASCO19 $AZN cc @PanCAN @lustgartenfdn","['megtirrell', 'astrazeneca', 'pancan', 'lustgartenfdn']",[],[],0,2,14,['#asco19'],['$azn'],https://twitter.com/CourtReagan/status/1135574335912128514,False,,0,,,,,,,"[{'user_id': '160983113', 'username': 'CourtReagan'}, {'user_id': '47678782', 'username': 'megtirrell'}, {'user_id': '62465691', 'username': 'AstraZeneca'}, {'user_id': '17007608', 'username': 'PanCAN'}, {'user_id': '22005069', 'username': 'lustgartenfdn'}]",
1135437044761669632,1135437044761669632,1559544261000,2019-06-03,01:44:21,CDT,479486066,meirsimchah,HappyLight,,"Only knew ""the BRCA gene"" from breast cancer. Just learned, it's actually 2 genes, BRCA1 & BRCA2, & their role is broad! They code proteins that repair damaged DNA. So a mutated BRCA makes it less likely the body eliminates potentially cancerous mutations.  https://www.cancer.gov/about-cancer/causes-prevention/genetics/brca-fact-sheet … https://twitter.com/PRehov/status/1135411634225201154 …",[],"['https://www.cancer.gov/about-cancer/causes-prevention/genetics/brca-fact-sheet', 'https://twitter.com/PRehov/status/1135411634225201154']",[],0,0,0,[],[],https://twitter.com/MeirSimchah/status/1135437044761669632,False,https://twitter.com/PRehov/status/1135411634225201154,0,,,,,,,"[{'user_id': '479486066', 'username': 'MeirSimchah'}]",
1134847712107663361,1134847712107663361,1559403753000,2019-06-01,10:42:33,CDT,572034894,theocedrone,Théo Cedrone,,My friend tested positive for the BRCA II Gene Mutation. We’re raising money to help her pay for preventative surgeries - without them she will be at an 84% increased risk of an aggressive form of breast cancer.   Please RT & donate if you can!!!    https://www.gofundme.com/nicoladamon ,[],['https://www.gofundme.com/nicoladamon'],[],0,3,3,[],[],https://twitter.com/TheoCedrone/status/1134847712107663361,False,,0,,,,,,,"[{'user_id': '572034894', 'username': 'TheoCedrone'}]",
1134490840041238528,1134490840041238528,1559318668000,2019-05-31,11:04:28,CDT,1071841692,joyurcaba,Jo Yurcaba,,"According to my insurance company, which I plan to openly shame on here at some point, genetic testing for the breast cancer gene isn't ""preventive care"" even with my family history. But genetic testing for colon cancer is. A BRCA gene test, without insurance, is ~$3,000",[],[],[],1,0,0,[],[],https://twitter.com/JoYurcaba/status/1134490840041238528,False,,0,,,,,,,"[{'user_id': '1071841692', 'username': 'JoYurcaba'}]",
1134490740581699584,1134490740581699584,1559318645000,2019-05-31,11:04:05,CDT,22151476,abmakulec,Amanda Makulec,,So #winecountrymovie is an adorable movie but the statement someone would find out they *have* breast cancer because of a #BRCA gene test result is wholly inaccurate. There's enough confusion about genetic testing without pop culture weighing in.  https://www.mayoclinic.org/tests-procedures/brca-gene-test/about/pac-20384815 … pic.twitter.com/IwzYJ1z0zN,[],['https://www.mayoclinic.org/tests-procedures/brca-gene-test/about/pac-20384815'],['https://pbs.twimg.com/media/D76FUDxWkAEWpUc.jpg'],1,1,2,"['#winecountrymovie', '#brca']",[],https://twitter.com/abmakulec/status/1134490740581699584,False,,0,,,,,,,"[{'user_id': '22151476', 'username': 'abmakulec'}]",
1133780100439203840,1133780100439203840,1559149215000,2019-05-29,12:00:15,CDT,3240296269,larryllapin,Lawrence L. Lapin,,#IARTG #SFRTG #ITRTG Vera Boatwright won’t test for BRCA gene leading to familial killer-breast-cancer. The professional violinist dreads career-ending prophylactic surgery more than death… Story in ADAM… FOREVER at Amazon [ASIN: B00EUSMJDO]  http://www.amazon.com/dp/B00EUSMJDO ,[],['http://www.amazon.com/dp/B00EUSMJDO'],[],0,0,0,"['#iartg', '#sfrtg', '#itrtg']",[],https://twitter.com/LarryLLapin/status/1133780100439203840,False,,0,,,,,,,"[{'user_id': '3240296269', 'username': 'LarryLLapin'}]",
1133747307265089536,1133742424134639617,1559141396000,2019-05-29,09:49:56,CDT,2866348663,new2uagain,Dem Gone Girl,,#RHOBHMeanGirls Kyle’s so GD fake (such a bad actress). I’ve done 1000’s of mammo’s & u r right she’s high risk. This should be old hat & she should’ve had BRCA gene testing. She should be using #RHOBH to talk about breast cancer awareness instead of talking shit on LVP. #SadKyle,"['monalisa987987', 'leiloo16']",[],[],1,1,9,"['#rhobhmeangirls', '#rhobh', '#sadkyle']",[],https://twitter.com/New2UAgain/status/1133747307265089536,False,,0,,,,,,,"[{'user_id': '2866348663', 'username': 'New2UAgain'}, {'user_id': '1054043613661986816', 'username': 'monalisa987987'}, {'user_id': '68307322', 'username': 'leiloo16'}]",
1133545042851848195,1133543133914882048,1559093173000,2019-05-28,20:26:13,CDT,318175823,ceciliacalvo,CCalvo,,My aunt had breast cancer and a few years later my mom also received a cancer diagnosis. My mom got tested after my aunts diagnosis and I got mine after my mom’s. None of us carry the BRCA gene but we are all very vigilant about it,['kylerichards'],[],[],0,0,5,[],[],https://twitter.com/CeciliaCalvo/status/1133545042851848195,False,,0,,,,,,,"[{'user_id': '318175823', 'username': 'CeciliaCalvo'}, {'user_id': '65773523', 'username': 'KyleRichards'}]",
