id,conversation_id,created_at,date,time,timezone,user_id,username,name,place,tweet,mentions,urls,photos,replies_count,retweets_count,likes_count,hashtags,cashtags,link,retweet,quote_url,video,near,geo,source,user_rt_id,user_rt,retweet_id,reply_to,retweet_date
1164437690646978560,1164437687727788032,1566458554000,2019-08-22,02:22:34,CDT,1151758642292486144,gmapinktober,gmapinktober,,It is recommended for men to consider seeing a genetics counselor for a consultation. If a man tests positive for a defective gene (most commonly either BRCA1 or BRCA2) that can lead to a future diagnosis of breast cancer and his children have a 50% chance of carrying the gene.,[],[],[],1,0,0,[],[],https://twitter.com/gmapinktober/status/1164437690646978560,False,,0,,,,,,,"[{'user_id': '1151758642292486144', 'username': 'gmapinktober'}]",
1164307906659008512,1164307906659008512,1566427611000,2019-08-21,17:46:51,CDT,46518729,stopmusclepain,"Jennifer Chu, M.D.",,"All-cause mortality after breast cancer was elevated by 67 per cent among those who had used aspirin at least once a week for six weeks pre-diagnosis and had a methylated tumour promotor of breast cancer gene 1, known as BRCA1.",[],[],[],0,0,0,[],[],https://twitter.com/stopmusclepain/status/1164307906659008512,False,,0,,,,,,,"[{'user_id': '46518729', 'username': 'stopmusclepain'}]",
1164290839893299200,1164290839893299200,1566423542000,2019-08-21,16:39:02,CDT,111128893,jcomm_blogfeeds,Jewish Community,,"US task force: Ashkenazi Jewish women should be screened for breast cancer genes: High level of BRCA1 or BRCA2 mutation found in Ashkenazi Jews; gene testing allows affected women to consider steps to lower their risk, like preventive…  http://dlvr.it/RBf3Z9  TimesofIsrael pic.twitter.com/1hTabAHwm0",[],['http://dlvr.it/RBf3Z9'],['https://pbs.twimg.com/media/EChkWUtVUAAxnIp.jpg'],0,1,1,[],[],https://twitter.com/JComm_BlogFeeds/status/1164290839893299200,False,,0,,,,,,,"[{'user_id': '111128893', 'username': 'JComm_BlogFeeds'}]",
1164004033608200200,1164003179736031233,1566355162000,2019-08-20,21:39:22,CDT,1330494462,karls_1021,Karlie Wellnitz,,"Breast cancer has eradicated 3 generations of women in my family, my aunt never got to meet her grandson, my mom watched her mom die at the ripe old age 15 years old. Every woman in my family has tested positive for BRCA1 (breast cancer gene).",[],[],[],1,0,2,[],[],https://twitter.com/karls_1021/status/1164004033608200200,False,,0,,,,,,,"[{'user_id': '1330494462', 'username': 'karls_1021'}]",
1163876987523330049,1163876987523330049,1566324872000,2019-08-20,13:14:32,CDT,1104914720,iowacityiowaa,Iowa City Iowa,,"* Expert panel updates advice on BRCA cancer gene screening  CNA * More women should be assessed for BRCA mutations, new recommendations say  CNN * Guidelines say more women may need breast cancer gene test   http://NBCNews.com  * BRCA1/2 genetic…  http://dlvr.it/RBZ8sf ",[],"['http://NBCNews.com', 'http://dlvr.it/RBZ8sf']",[],0,0,0,[],[],https://twitter.com/IowaCityIowaa/status/1163876987523330049,False,,0,,,,,,,"[{'user_id': '1104914720', 'username': 'IowaCityIowaa'}]",
1163174835645759489,1163159849539997696,1566157466000,2019-08-18,14:44:26,CDT,888849732,othellomor,M.A.Maceo,,"No 2 ppl born same & WMN all have slightly different chances of developing cancers! It's natural variation, BUT  abt 1 in 1,000 people inherit a damaged copy of gene like BRCA1! 50K WMN per/yr have breast cancer- Stage 4 I see her logic- What's worse AM of Alcohol WMN consume!","['celiaatunes24', 'withmyflawsnall']",[],[],1,0,2,[],[],https://twitter.com/othellomor/status/1163174835645759489,False,,0,,,,,,,"[{'user_id': '888849732', 'username': 'othellomor'}, {'user_id': '3348105333', 'username': 'CeliaAtunes24'}, {'user_id': '2462510742', 'username': 'Withmyflawsnall'}]",
1162037407178473472,1161775013483163648,1565886282000,2019-08-15,11:24:42,CDT,14724376,_katerr,Kate,,Some suggest starting before 40 if you've got the BRCA1 or BRCA2 gene or if a close relation like a mother or sister has been diagnosed with breast cancer.,"['miss_close', 'dartmouthdogs', 'halfcup_awesome', 'nsdebbi', 'lynesworld']",[],[],2,0,1,[],[],https://twitter.com/_katerr/status/1162037407178473472,False,,0,,,,,,,"[{'user_id': '14724376', 'username': '_katerr'}, {'user_id': '125185280', 'username': 'Miss_Close'}, {'user_id': '260334086', 'username': 'DartmouthDogs'}, {'user_id': '84104628', 'username': 'halfcup_awesome'}, {'user_id': '18806626', 'username': 'nsdebbi'}, {'user_id': '472396127', 'username': 'lynesworld'}]",
1161764186076143616,1161764186076143616,1565821141000,2019-08-14,17:19:01,CDT,41380057,nciprevention,NCI Prevention,,Bilateral prophylactic mastectomy has been shown to reduce the risk of breast cancer by at least 95% in women who have mutations in the BRCA1 or BRCA2 gene and by up to 90% in women who have a strong family history of breast cancer  https://buff.ly/2OvLTkS  #bcsm pic.twitter.com/7OqDmq5jfY,[],['https://buff.ly/2OvLTkS'],['https://pbs.twimg.com/media/EB9qXucXsAIyGxB.jpg'],1,22,33,['#bcsm'],[],https://twitter.com/NCIprevention/status/1161764186076143616,False,,0,,,,,,,"[{'user_id': '41380057', 'username': 'NCIprevention'}]",
1161526814503833604,1161526814503833604,1565764547000,2019-08-14,01:35:47,CDT,976043482908372992,nursingwriting1,Nursing Writings,,"Describe and explain the role of the BRCA1 and breast cancer 2, early onset (BRCA2) gene in contribution as a risk factor for breast cancer.  https://nursingwritingservices.net/describe-and-explain-the-role-of-the-brca1-and-breast-cancer-2-early-onset-brca2-gene-in-contribution-as-a-risk-factor-for-breast-cancer-9/ …",[],['https://nursingwritingservices.net/describe-and-explain-the-role-of-the-brca1-and-breast-cancer-2-early-onset-brca2-gene-in-contribution-as-a-risk-factor-for-breast-cancer-9/'],[],0,0,0,[],[],https://twitter.com/NursingWriting1/status/1161526814503833604,False,,0,,,,,,,"[{'user_id': '976043482908372992', 'username': 'NursingWriting1'}]",
1160791184853413888,1160765774279127040,1565589159000,2019-08-12,00:52:39,CDT,1128585422,joe_widdup,Joe Widdup,,Regardless of addiction it's very. very. bad for you. It's carcinogenic enough that if it was a newly created product it would never get FDA approval. Alcohol consumption in the developed world causes more cases of breast cancer than the BRCA1 gene.,['shianihughes15'],[],[],0,0,2,[],[],https://twitter.com/Joe_Widdup/status/1160791184853413888,False,,0,,,,,,,"[{'user_id': '1128585422', 'username': 'Joe_Widdup'}, {'user_id': '1239227179', 'username': 'shianihughes15'}]",
1155731332581998592,1155528012890177536,1564382796000,2019-07-29,01:46:36,CDT,1272310711,smcmenemin,Stewart McM,,Are you seriously arguing this? I would have identical twin relatives of 70 but one died of breast cancer 30+ yrs ago. Breast cancer as you know has a strong genetic link. The surviving twin had genetic tests 3 yrs ago and is positive for the BRCA1 gene and is alive and healthy.,"['bglthmnd', 'thekidkiddoc']",[],[],2,0,6,[],[],https://twitter.com/SMcMenemin/status/1155731332581998592,False,,0,,,,,,,"[{'user_id': '1272310711', 'username': 'SMcMenemin'}, {'user_id': '4611508512', 'username': 'BGLTHMND'}, {'user_id': '753672654607953921', 'username': 'TheKidKidDoc'}]",
1155356903070846977,1155356899359023105,1564293525000,2019-07-28,00:58:45,CDT,1151758642292486144,gmapinktober,gmapinktober,,"Inherited breast cancer occurs when gene changes called mutations are passed down within a family from parent to child. Many of those mutations are in tumor suppression genes, such as BRCA1 or BRCA2.",[],[],[],1,0,0,[],[],https://twitter.com/gmapinktober/status/1155356903070846977,False,,0,,,,,,,"[{'user_id': '1151758642292486144', 'username': 'gmapinktober'}]",
1154422435850137606,1154422435850137606,1564070731000,2019-07-25,11:05:31,CDT,976043482908372992,nursingwriting1,Nursing Writings,,"Describe and explain the role of the BRCA1 and breast cancer 2, early onset (BRCA2) gene in contribution as a risk factor for breast cancer.  https://nursingwritingservices.net/describe-and-explain-the-role-of-the-brca1-and-breast-cancer-2-early-onset-brca2-gene-in-contribution-as-a-risk-factor-for-breast-cancer-7/ …",[],['https://nursingwritingservices.net/describe-and-explain-the-role-of-the-brca1-and-breast-cancer-2-early-onset-brca2-gene-in-contribution-as-a-risk-factor-for-breast-cancer-7/'],[],0,0,0,[],[],https://twitter.com/NursingWriting1/status/1154422435850137606,False,,0,,,,,,,"[{'user_id': '976043482908372992', 'username': 'NursingWriting1'}]",
1154373928678305792,1154373928678305792,1564059166000,2019-07-25,07:52:46,CDT,1011779337878691840,tracy67462263,BRCAStrong,,Do you know your risks for the BRCA gene? A woman’s lifetime risk of developing breast and/or ovarian cancer is greatly increased if she inherits a harmful mutation in BRCA1 or BRCA2. Breast cancer: About 12% of…  https://www.instagram.com/p/B0VyWBZA0D-/?igshid=1xpl05k05ikef …,[],['https://www.instagram.com/p/B0VyWBZA0D-/?igshid=1xpl05k05ikef'],[],0,0,0,[],[],https://twitter.com/Tracy67462263/status/1154373928678305792,False,,0,,,,,,,"[{'user_id': '1011779337878691840', 'username': 'Tracy67462263'}]",
1153666241325928448,1153666241325928448,1563890440000,2019-07-23,09:00:40,CDT,470179234,collettaorr,Colletta Orr,,"On average, a woman with a #BRCA1 or #BRCA2 gene mutation has about a 7 in 10 chance of getting breast cancer by age 80. This risk is also affected by how many other family members have had #breastcancer.",[],[],[],0,0,1,"['#brca1', '#brca2', '#breastcancer']",[],https://twitter.com/CollettaOrr/status/1153666241325928448,False,,0,,,,,,,"[{'user_id': '470179234', 'username': 'CollettaOrr'}]",
1152847220389142528,1152847220389142528,1563695170000,2019-07-21,02:46:10,CDT,876793871845519360,pathredcongress,PathReD 2019 Congress,,"""About 10% of unselected black women with breast cancer below the age of 50, with no family history, have a BRCA1 /BRCA2 gene mutation"" - Prof Amanda Krause #PathRed2019",[],[],[],0,2,2,['#pathred2019'],[],https://twitter.com/PathReDCongress/status/1152847220389142528,False,,0,,,,,,,"[{'user_id': '876793871845519360', 'username': 'PathReDCongress'}]",
1152672895317028865,1152672895317028865,1563653608000,2019-07-20,15:13:28,CDT,1117106942437146624,new_vintage_nyc,Marv’,,@23andMe: I can’t believe you only test for Jewish variants BRCA1/2 cancer gene! I am BRCA2 positive as per REAL DNA test but NOT on ur report AND I currently have breast cancer at 40years-old. Check all or don’t bother bc it’s a very dangerous false negative,['23andme'],[],[],0,0,0,[],[],https://twitter.com/New_Vintage_NYC/status/1152672895317028865,False,,0,,,,,,,"[{'user_id': '1117106942437146624', 'username': 'New_Vintage_NYC'}, {'user_id': '14738561', 'username': '23andMe'}]",
1152058893096214528,1152058893096214528,1563507218000,2019-07-18,22:33:38,CDT,78815112,cubebytes,Cube PR,,A new #trial is being carried out in Australia which uses an #osteopetrosis drug on women who carry the BRCA1 and BRCA2 breast cancer gene mutation. @ABCNews @MeaganDillon7 @lmaclennan https://ab.co/2O4BrEx ,"['abcnews', 'meagandillon7', 'lmaclennan']",['https://ab.co/2O4BrEx'],[],0,0,0,"['#trial', '#osteopetrosis']",[],https://twitter.com/CubeBytes/status/1152058893096214528,False,,0,,,,,,,"[{'user_id': '78815112', 'username': 'CubeBytes'}, {'user_id': '2768501', 'username': 'abcnews'}, {'user_id': '2352791712', 'username': 'MeaganDillon7'}, {'user_id': '33835570', 'username': 'lmaclennan'}]",
1151990515262349314,1151990515262349314,1563490916000,2019-07-18,18:01:56,CDT,2352791712,meagandillon7,Meagan Dillon,,Angelina Jolie put breast cancer gene mutation testing in the spotlight after getting a double mastectomy. BRCA1 is highly-publicised to impact women. But men can also carry it. The Hicks brothers hope a new drug trial is successful @abcadelaide  https://ab.co/2O4BrEx ,['abcadelaide'],['https://ab.co/2O4BrEx'],[],0,0,3,[],[],https://twitter.com/MeaganDillon7/status/1151990515262349314,False,,0,,,,,,,"[{'user_id': '2352791712', 'username': 'MeaganDillon7'}, {'user_id': '16213139', 'username': 'abcadelaide'}]",
1151959073853599744,1151959073853599744,1563483420000,2019-07-18,15:57:00,CDT,9609582,thetiser,The Advertiser,,A world-first clinical trial in SA aims to prevent breast cancer in women with the BRCA1 gene.  http://bit.ly/32uPma5  #Adelaide #cancer,[],['http://bit.ly/32uPma5'],[],0,1,1,"['#adelaide', '#cancer']",[],https://twitter.com/theTiser/status/1151959073853599744,False,,0,,,,,,,"[{'user_id': '9609582', 'username': 'theTiser'}]",
1151752033277317120,1151752033277317120,1563434057000,2019-07-18,02:14:17,CDT,2457242828,fcanceraus,F Cancer,,HOPE: Drug trial aims to save women with the deadly breast cancer BRCA1 gene from their fate -  https://goo.gl/alerts/AQmbG ,[],['https://goo.gl/alerts/AQmbG'],[],0,0,0,[],[],https://twitter.com/FCancerAus/status/1151752033277317120,False,,0,,,,,,,"[{'user_id': '2457242828', 'username': 'FCancerAus'}]",
1151305062011961344,1151305062011961344,1563327491000,2019-07-16,20:38:11,CDT,832620827833094147,wellnesstvgroup,HealthWellnessCapitalGroup,,"1/4   http://BreastCancer.org  state some 5 to 10 percent of all female breast cancer cases in the U.S. are hereditary. This means that an abnormal gene is passed on from parent to child, which is often the BRCA1 or BRCA2 mutation",[],['http://BreastCancer.org'],[],1,0,0,[],[],https://twitter.com/WellnessTVGroup/status/1151305062011961344,False,,0,,,,,,,"[{'user_id': '832620827833094147', 'username': 'WellnessTVGroup'}]",
1150374632924602370,1150374632924602370,1563105660000,2019-07-14,07:01:00,CDT,2833754464,sophiagenetics,SOPHiA GENETICS,,Ovarian and breast cancer research finds new ways BRCA1 gene functions  https://medicalxpress.com/news/2019-07-ovarian-breast-cancer-ways-brca1.html … via @medical_xpress,['medical_xpress'],['https://medicalxpress.com/news/2019-07-ovarian-breast-cancer-ways-brca1.html'],[],0,1,2,[],[],https://twitter.com/SOPHiAGENETICS/status/1150374632924602370,False,,0,,,,,,,"[{'user_id': '2833754464', 'username': 'SOPHiAGENETICS'}, {'user_id': '287568380', 'username': 'medical_xpress'}]",
1150057014405607426,1150050979909439490,1563029933000,2019-07-13,09:58:53,CDT,2780395189,treda10,Fenia Petran,,"The BRCA gene test is a genetic blood test that uses DNA analysis to identify mutations in either one of the two breast cancer susceptibility genes, BRCA1 and BRCA2.",['thenci'],[],[],0,0,0,[],[],https://twitter.com/treda10/status/1150057014405607426,False,,0,,,,,,,"[{'user_id': '2780395189', 'username': 'treda10'}, {'user_id': '38530021', 'username': 'theNCI'}]",
1149758833872592896,1149758833872592896,1562958842000,2019-07-12,14:14:02,CDT,41380057,nciprevention,NCI Prevention,,Bilateral prophylactic mastectomy has been shown to reduce the risk of breast cancer by at least 95% in women who have mutations in the BRCA1 or BRCA2 gene and by up to 90% in women who have a strong family history of breast cancer  https://buff.ly/2OvLTkS  #bcsm pic.twitter.com/3UpjfMTMOH,[],['https://buff.ly/2OvLTkS'],['https://pbs.twimg.com/media/D_TDkP2WwAEqmgr.jpg'],0,18,15,['#bcsm'],[],https://twitter.com/NCIprevention/status/1149758833872592896,False,,0,,,,,,,"[{'user_id': '41380057', 'username': 'NCIprevention'}]",
1149450428104486912,1149450428104486912,1562885312000,2019-07-11,17:48:32,CDT,950810693569318917,bioengineerorg,Bioengineer.org,,Ovarian and breast cancer research finds new ways BRCA1 gene functions  https://bioengineer.org/?p=117733 ,[],['https://bioengineer.org/?p=117733'],[],0,0,1,[],[],https://twitter.com/bioengineerorg/status/1149450428104486912,False,,0,,,,,,,"[{'user_id': '950810693569318917', 'username': 'bioengineerorg'}]",
1148936155716640770,1148936155716640770,1562762700000,2019-07-10,07:45:00,CDT,1900641278,bestbreastnews,BestBreastNews,,Ovarian and breast cancer research finds new ways BRCA1 gene functions   https://bit.ly/2Xri9gL  pic.twitter.com/xJ8uG4m7C2,[],['https://bit.ly/2Xri9gL'],['https://pbs.twimg.com/media/D-o0xrUXkAADjYB.jpg'],0,0,0,[],[],https://twitter.com/BestBreastNews/status/1148936155716640770,False,,0,,,,,,,"[{'user_id': '1900641278', 'username': 'BestBreastNews'}]",
1148489397949440000,1148489384569651200,1562656185000,2019-07-09,02:09:45,CDT,1024324788615929857,rutterlab,Rutter Lab,,"The discovery of the ""breast cancer gene"" revolutionized the study of numerous other common diseases. The technique King developed to identify BRCA1 has since proven valuable in the study of many other illnesses and conditions.  https://go.nature.com/2xF9NTv  11/",[],['https://go.nature.com/2xF9NTv'],[],1,0,3,[],[],https://twitter.com/RutterLab/status/1148489397949440000,False,,0,,,,,,,"[{'user_id': '1024324788615929857', 'username': 'RutterLab'}]",
1148294449069318144,1148294449069318144,1562609705000,2019-07-08,13:15:05,CDT,164579558,_medjournal,Internet Medical,,Ovarian and breast cancer research finds new ways BRCA1 gene functions  http://dlvr.it/R82G7p ,[],['http://dlvr.it/R82G7p'],[],0,0,0,[],[],https://twitter.com/_medjournal/status/1148294449069318144,False,,0,,,,,,,"[{'user_id': '164579558', 'username': '_medjournal'}]",
1148272803197571072,1148272803197571072,1562604544000,2019-07-08,11:49:04,CDT,803291924,howtobeatcancer,Tom,,Ovarian and breast cancer research finds new ways BRCA1 gene functions - Science Daily  http://dlvr.it/R821b5 ,[],['http://dlvr.it/R821b5'],[],0,0,0,[],[],https://twitter.com/howtobeatcancer/status/1148272803197571072,False,,0,,,,,,,"[{'user_id': '803291924', 'username': 'howtobeatcancer'}]",
1148244606942760961,1148244606942760961,1562597822000,2019-07-08,09:57:02,CDT,2785097010,svtpunch,lei,,".@PlayOverwatch hey, did you know that breast cancer and ovarian cancer share the same mutated gene? BRCA1 and BRCA2. since you did the pink breast cancer skin for mercy, why not do an ovarian cancer one as well? the cause would be amazing, ovarian cancer is often overlooked!",['playoverwatch'],[],[],0,0,1,[],[],https://twitter.com/SVTPUNCH/status/1148244606942760961,False,,0,,,,,,,"[{'user_id': '2785097010', 'username': 'SVTPUNCH'}, {'user_id': '2420931980', 'username': 'PlayOverwatch'}]",
1147774455730573312,1147774455730573312,1562485729000,2019-07-07,02:48:49,CDT,950810693569318917,bioengineerorg,Bioengineer.org,,Ovarian and breast cancer research finds new ways BRCA1 gene functions  https://bioengineer.org/?p=117733 ,[],['https://bioengineer.org/?p=117733'],[],0,0,0,[],[],https://twitter.com/bioengineerorg/status/1147774455730573312,False,,0,,,,,,,"[{'user_id': '950810693569318917', 'username': 'bioengineerorg'}]",
1147552292645687297,1147552292645687297,1562432761000,2019-07-06,12:06:01,CDT,41495385,brightsurf,Brightsurf.com,,Ovarian and breast #cancer research finds new ways BRCA1 #gene functions  https://www.brightsurf.com/news/article/070319487059/ovarian-and-breast-cancer-research-finds-new-ways-brca1-gene-functions.html …,[],['https://www.brightsurf.com/news/article/070319487059/ovarian-and-breast-cancer-research-finds-new-ways-brca1-gene-functions.html'],[],0,0,0,"['#cancer', '#gene']",[],https://twitter.com/brightsurf/status/1147552292645687297,False,,0,,,,,,,"[{'user_id': '41495385', 'username': 'brightsurf'}]",
1147475379504001024,1147475379504001024,1562414424000,2019-07-06,07:00:24,CDT,47605629,mmbtox,marie bourgeois,,Ovarian and breast cancer research finds new ways BRCA1 gene functions  https://www.sciencedaily.com/releases/2019/07/190703134058.htm …,[],['https://www.sciencedaily.com/releases/2019/07/190703134058.htm'],[],0,0,0,[],[],https://twitter.com/mmbtox/status/1147475379504001024,False,,0,,,,,,,"[{'user_id': '47605629', 'username': 'mmbtox'}]",
1147425852130357248,1147425852130357248,1562402615000,2019-07-06,03:43:35,CDT,1310123689,sophiadevetzi,Sophia Devetzi,,Ovarian and breast cancer research finds new ways BRCA1 gene functions  http://bit.ly/2XssQQk ,[],['http://bit.ly/2XssQQk'],[],0,0,0,[],[],https://twitter.com/SophiaDevetzi/status/1147425852130357248,False,,0,,,,,,,"[{'user_id': '1310123689', 'username': 'SophiaDevetzi'}]",
1147224895895539712,1147224895895539712,1562354704000,2019-07-05,14:25:04,CDT,191596401,cqsum,QSUM,,Ovarian and breast cancer research finds new ways BRCA1 gene functions  http://ow.ly/1Jat50uTEoY ,[],['http://ow.ly/1Jat50uTEoY'],[],0,0,0,[],[],https://twitter.com/CQSUM/status/1147224895895539712,False,,0,,,,,,,"[{'user_id': '191596401', 'username': 'CQSUM'}]",
1147218839408562176,1147218839408562176,1562353260000,2019-07-05,14:01:00,CDT,706866298899181569,justgojotravel,J.Kathleen Thompson,,Ovarian and breast cancer research finds new ways BRCA1 gene functions  https://www.sciencedaily.com/releases/2019/07/190703134058.htm …,[],['https://www.sciencedaily.com/releases/2019/07/190703134058.htm'],[],0,0,0,[],[],https://twitter.com/justgojotravel/status/1147218839408562176,False,,0,,,,,,,"[{'user_id': '706866298899181569', 'username': 'justgojotravel'}]",
1147181013975654401,1147181013975654401,1562344241000,2019-07-05,11:30:41,CDT,817356391333629952,cellworkslife,CellworksLife,,Ovarian and breast cancer research finds new ways BRCA1 gene functions.  https://medicalxpress.com/news/2019-07-ovarian-breast-cancer-ways-brca1.html … #OvarianCancer #BreastCancer,[],['https://medicalxpress.com/news/2019-07-ovarian-breast-cancer-ways-brca1.html'],[],0,3,1,"['#ovariancancer', '#breastcancer']",[],https://twitter.com/CellworksLife/status/1147181013975654401,False,,0,,,,,,,"[{'user_id': '817356391333629952', 'username': 'CellworksLife'}]",
1147139194143367169,1147139194143367169,1562334271000,2019-07-05,08:44:31,CDT,985067910,julieewash,Julie E. Washington,,Ovarian and breast cancer research finds new ways BRCA1 gene functions  https://www.sciencedaily.com/releases/2019/07/190703134058.htm …,[],['https://www.sciencedaily.com/releases/2019/07/190703134058.htm'],[],0,0,0,[],[],https://twitter.com/JulieEWash/status/1147139194143367169,False,,0,,,,,,,"[{'user_id': '985067910', 'username': 'JulieEWash'}]",
1147053938543403008,1147053938543403008,1562313944000,2019-07-05,03:05:44,CDT,4892309656,rfhmlibrary,Royal Free Library,,Ovarian and breast cancer research finds new ways BRCA1 gene functions  https://www.sciencedaily.com/releases/2019/07/190703134058.htm … #breastcancer #ovariancancer,[],['https://www.sciencedaily.com/releases/2019/07/190703134058.htm'],[],0,0,0,"['#breastcancer', '#ovariancancer']",[],https://twitter.com/RFHMLibrary/status/1147053938543403008,False,,0,,,,,,,"[{'user_id': '4892309656', 'username': 'RFHMLibrary'}]",
1147034514377662464,1147034514377662464,1562309313000,2019-07-05,01:48:33,CDT,950810693569318917,bioengineerorg,Bioengineer.org,,Ovarian and breast cancer research finds new ways BRCA1 gene functions  https://bioengineer.org/?p=117733 ,[],['https://bioengineer.org/?p=117733'],[],0,0,1,[],[],https://twitter.com/bioengineerorg/status/1147034514377662464,False,,0,,,,,,,"[{'user_id': '950810693569318917', 'username': 'bioengineerorg'}]",
1146895984032485376,1146895984032485376,1562276285000,2019-07-04,16:38:05,CDT,1118348301844144128,shalivahana7,Shalivahana,,Ovarian and breast cancer research finds new ways BRCA1 gene functions  http://dlvr.it/R7qWLv ,[],['http://dlvr.it/R7qWLv'],[],0,0,0,[],[],https://twitter.com/Shalivahana7/status/1146895984032485376,False,,0,,,,,,,"[{'user_id': '1118348301844144128', 'username': 'Shalivahana7'}]",
1146891451143294976,1146891451143294976,1562275204000,2019-07-04,16:20:04,CDT,1613592559,iamcivilengg,Civil Engineering,,Ovarian and breast cancer research finds new ways BRCA1 gene functions  http://dlvr.it/R7qTg7 ,[],['http://dlvr.it/R7qTg7'],[],0,0,1,[],[],https://twitter.com/iamcivilengg/status/1146891451143294976,False,,0,,,,,,,"[{'user_id': '1613592559', 'username': 'iamcivilengg'}]",
1146887425890779136,1146887425890779136,1562274245000,2019-07-04,16:04:05,CDT,2385825444,acepainmgmt,Ace Pain Management,,Ovarian and breast cancer research finds new ways BRCA1 gene functions  http://dlvr.it/R7qS29 ,[],['http://dlvr.it/R7qS29'],[],0,0,0,[],[],https://twitter.com/ACEPainMgmt/status/1146887425890779136,False,,0,,,,,,,"[{'user_id': '2385825444', 'username': 'ACEPainMgmt'}]",
1146873211168026624,1146873211168026624,1562270856000,2019-07-04,15:07:36,CDT,819645822,science_news01,Science News,,Ovarian and breast cancer research finds new ways BRCA1 gene functions  https://www.sciencedaily.com/releases/2019/07/190703134058.htm?utm_source=dlvr.it&utm_medium=twitter …,[],['https://www.sciencedaily.com/releases/2019/07/190703134058.htm?utm_source=dlvr.it&utm_medium=twitter'],[],0,0,0,[],[],https://twitter.com/Science_News01/status/1146873211168026624,False,,0,,,,,,,"[{'user_id': '819645822', 'username': 'Science_News01'}]",
1146873081949855744,1146873081949855744,1562270825000,2019-07-04,15:07:05,CDT,832620827833094147,wellnesstvgroup,HealthWellnessCapitalGroup,,#Ovarian and #breast #cancer research finds new ways #BRCA1 gene functions  https://www.sciencedaily.com/releases/2019/07/190703134058.htm …,[],['https://www.sciencedaily.com/releases/2019/07/190703134058.htm'],[],0,0,0,"['#ovarian', '#breast', '#cancer', '#brca1']",[],https://twitter.com/WellnessTVGroup/status/1146873081949855744,False,,0,,,,,,,"[{'user_id': '832620827833094147', 'username': 'WellnessTVGroup'}]",
1146869434537185280,1146869434537185280,1562269955000,2019-07-04,14:52:35,CDT,999171150608388096,social_media_b8,Science and Technology News,,Ovarian and breast cancer research finds new ways BRCA1 gene functions  https://www.sciencedaily.com/releases/2019/07/190703134058.htm … via @circleboom,['circleboom'],['https://www.sciencedaily.com/releases/2019/07/190703134058.htm'],[],0,0,0,[],[],https://twitter.com/Social_Media_b8/status/1146869434537185280,False,,0,,,,,,,"[{'user_id': '999171150608388096', 'username': 'Social_Media_b8'}, {'user_id': '916052708930588672', 'username': 'circleboom'}]",
