id,conversation_id,created_at,date,time,timezone,user_id,username,name,place,tweet,mentions,urls,photos,replies_count,retweets_count,likes_count,hashtags,cashtags,link,retweet,quote_url,video,near,geo,source,user_rt_id,user_rt,retweet_id,reply_to,retweet_date
1164380659835723777,1164083480000684037,1566444957000,2019-08-21,22:35:57,CDT,1002270483411296256,gardnerannam,ISTILLFIGHTALONE🆘,,My sister had it and she had a lumpectomy and radiation but no chemo. That was 20 years ago. She's 78 and still working.,"['bobbieg611', 'jmo2221', 'xaj123', 'sarah_skg_1983', 'simplyjustbeing', 'sadietnresist', 'resisterforever', 'demerk', 'kimmi1965', 'andypopeinthew1', 'grbucks', 'karywin', 'asnorm', 'palmeralpha1', 'bevfriesen1', 'veritatis_vox', 'dukesmama2', 'mustanglvr_gtcs', 'politicsdiva817', 'msgrumpybunny', 'pissoffcult45', 'swanwhisperr', 'frozensiclegirl', 'surfsidesams', 'reneeweathers2', 'mayo4mz', 'michelle_spenc', 'vagyver', 'kitchen5203', 'brendabalazs', 'theheat1984', 'maltomash', 'carlyja22', 'snowleopard87', 'jerryhervey', 'amhotflash', 'cdubey_texas', 'hewholoveswords', 'dhershiser', 'drwineau', 'pinkyd124', '1918champs', 'westernmainecc1', 'rayofliteindark', 'eathbound420', 'twoschaos', 'bissygumdrops', 'queeniebee99']",[],[],0,0,6,[],[],https://twitter.com/gardnerannam/status/1164380659835723777,False,,0,,,,,,,"[{'user_id': '1002270483411296256', 'username': 'gardnerannam'}, {'user_id': '1008832156859289604', 'username': 'Bobbieg611'}, {'user_id': '1156776375967191040', 'username': 'JMo2221'}, {'user_id': '1109511618734493696', 'username': 'xaJ123'}, {'user_id': '131232784', 'username': 'Sarah_SKG_1983'}, {'user_id': '22211336', 'username': 'simplyjustbeing'}, {'user_id': '2502967792', 'username': 'SadieTNResist'}, {'user_id': '745161748731203584', 'username': 'ResisterForever'}, {'user_id': '95305450', 'username': 'Demerk'}, {'user_id': '707203777313382400', 'username': 'Kimmi1965'}, {'user_id': '1008534511540424704', 'username': 'AndyPopeInTheW1'}, {'user_id': '2327223268', 'username': 'Grbucks'}, {'user_id': '22306114', 'username': 'karywin'}, {'user_id': '45028927', 'username': 'asnorm'}, {'user_id': '885837276391002114', 'username': 'palmeralpha1'}, {'user_id': '811881169016893441', 'username': 'Bevfriesen1'}, {'user_id': '1033023046767058949', 'username': 'veritatis_vox'}, {'user_id': '1148817440475942919', 'username': 'DukesMama2'}, {'user_id': '24258702', 'username': 'Mustanglvr_GTCS'}, {'user_id': '159323860', 'username': 'politicsdiva817'}, {'user_id': '3052406629', 'username': 'msgrumpybunny'}, {'user_id': '880827295530975232', 'username': 'PissOffCult45'}, {'user_id': '2155343155', 'username': 'SwanWhisperr'}, {'user_id': '117989854', 'username': 'FrozenSicleGirl'}, {'user_id': '766121934', 'username': 'SurfSideSams'}, {'user_id': '997166407002472448', 'username': 'RENEEWEATHERS2'}, {'user_id': '1033384502796722176', 'username': 'Mayo4Mz'}, {'user_id': '1026230866484363265', 'username': 'michelle_spenc'}, {'user_id': '19797588', 'username': 'VaGyver'}, {'user_id': '720323991894798336', 'username': 'kitchen5203'}, {'user_id': '913551582884696065', 'username': 'BrendaBalazs'}, {'user_id': '1141503559403544577', 'username': 'TheHeat1984'}, {'user_id': '111664523', 'username': 'Maltomash'}, {'user_id': '2423008116', 'username': 'CarlyJA22'}, {'user_id': '402955158', 'username': 'snowleopard87'}, {'user_id': '801761404676145153', 'username': 'JerryHervey'}, {'user_id': '258134278', 'username': 'AMHotFlash'}, {'user_id': '957112964313579521', 'username': 'Cdubey_Texas'}, {'user_id': '724954296605917184', 'username': 'HeWhoLovesWords'}, {'user_id': '175042044', 'username': 'dhershiser'}, {'user_id': '253700203', 'username': 'drwineau'}, {'user_id': '826803049356226562', 'username': 'PinkyD124'}, {'user_id': '173102450', 'username': '1918champs'}, {'user_id': '1021724177475268608', 'username': 'westernmainecc1'}, {'user_id': '933174729694896128', 'username': 'rayofliteindark'}, {'user_id': '1026282888474443776', 'username': 'Eathbound420'}, {'user_id': '118464986', 'username': 'twoschaos'}, {'user_id': '1021525497254227970', 'username': 'bissygumdrops'}, {'user_id': '911975688126599168', 'username': 'queeniebee99'}]",
1164332372944412672,1164330427861078016,1566433444000,2019-08-21,19:24:04,CDT,83455021,brooklyntonnarr,Brooklyn Tonnar ⚡️🌈,,Did she have a lumpectomy or mastectomy? Praying for her!,['beccamarie014'],[],[],1,0,0,[],[],https://twitter.com/brooklyntonnarr/status/1164332372944412672,False,,0,,,,,,,"[{'user_id': '83455021', 'username': 'brooklyntonnarr'}, {'user_id': '545684499', 'username': 'beccamarie014'}]",
1164312666200055808,1164266803348103170,1566428746000,2019-08-21,18:05:46,CDT,825488104966471681,bnelsen68,B Nelsen🌊🌊🌊,,"Diagnosed two weeks after my 65th. Lumpectomy/radiation & daily low dose chemo pill. Coming up on 5years cancer free. My advice? Be positive. Stay positive. Do EVERYTHING your doctor's tell you to do. Do not listen to the ""this is what happened to me"" stories. You can do this.  pic.twitter.com/y7htkLh3oy",['pet_loverva'],[],['https://pbs.twimg.com/media/ECh4MOPXUAU2PzO.jpg'],0,0,1,[],[],https://twitter.com/BNelsen68/status/1164312666200055808,False,,0,,,,,,,"[{'user_id': '825488104966471681', 'username': 'BNelsen68'}, {'user_id': '833798400562888706', 'username': 'pet_loverva'}]",
1164295349667635200,1164266803348103170,1566424617000,2019-08-21,16:56:57,CDT,2713591741,elisabeth_pal,Elisabeth Pal,,"Mum and I had breast cancer at the same time in 2006. Her mother died from the desease. After lumpectomy and radiation we are both cancer free, 13 years later. Positive thoughts sent your way. 😊",['pet_loverva'],[],[],1,0,5,[],[],https://twitter.com/elisabeth_pal/status/1164295349667635200,False,,0,,,,,,,"[{'user_id': '2713591741', 'username': 'elisabeth_pal'}, {'user_id': '833798400562888706', 'username': 'pet_loverva'}]",
1164262188045000704,1164262188045000704,1566416711000,2019-08-21,14:45:11,CDT,708364762132914176,marginprobe,MarginProbe,,"""I was fortunate to have MarginProbe used during my #lumpectomy."" Patients tell their story. #fightlikeagirl http://bit.ly/2BQeIlu ",[],['http://bit.ly/2BQeIlu'],[],0,0,0,"['#lumpectomy', '#fightlikeagirl']",[],https://twitter.com/MarginProbe/status/1164262188045000704,False,,0,,,,,,,"[{'user_id': '708364762132914176', 'username': 'MarginProbe'}]",
1164257541699723264,1164257541699723264,1566415603000,2019-08-21,14:26:43,CDT,841360138749513729,umichpath,Michigan Pathology,,"🔬#BreastPath, Day 3  ➡️What’s your #DailyDx of this breast lumpectomy?  ➡️What myoepithelial staining pattern(s) would you expect and how would you T stage?  ➡️We’ll tweet the answers, some quick facts, and the next case tomorrow! #UMichPath pic.twitter.com/4sKiHqr2y5",[],[],"['https://pbs.twimg.com/media/EChGDuKU0AAFrEw.jpg', 'https://pbs.twimg.com/media/EChGDuLUEAA-Glq.jpg', 'https://pbs.twimg.com/media/EChGDuMUYAAnCWH.jpg']",12,13,32,"['#breastpath', '#dailydx', '#umichpath']",[],https://twitter.com/UMichPath/status/1164257541699723264,False,,0,,,,,,,"[{'user_id': '841360138749513729', 'username': 'UMichPath'}]",
1164232400077053952,1164197500099670016,1566409609000,2019-08-21,12:46:49,CDT,786712065754931200,rivereac,Erika Cromwell,,Hope you get good results. I now routinely get them due to my chemo. I actually dread how much it hurts when they dig the wand into my lumpectomy scars. Luckily it doesn't last long.,['jessieh3129'],[],[],0,0,1,[],[],https://twitter.com/rivereac/status/1164232400077053952,False,,0,,,,,,,"[{'user_id': '786712065754931200', 'username': 'rivereac'}, {'user_id': '1025130297262829568', 'username': 'jessieh3129'}]",
1164166533310029825,1164166533310029825,1566393905000,2019-08-21,08:25:05,CDT,708364762132914176,marginprobe,MarginProbe,,More and more #lumpectomy patients are asking their surgeons about MarginProbe. Here's why. #beatbreastcancer  http://bit.ly/2xGKWhk ,[],['http://bit.ly/2xGKWhk'],[],0,0,0,"['#lumpectomy', '#beatbreastcancer']",[],https://twitter.com/MarginProbe/status/1164166533310029825,False,,0,,,,,,,"[{'user_id': '708364762132914176', 'username': 'MarginProbe'}]",
1163964433141522432,1163594175100489728,1566345720000,2019-08-20,19:02:00,CDT,700232443,eyevey,EyeVey,,"Tammy, back in ‘01 when I had a lumpectomy, I asked them if they could do do a head to toe overhaul. Facelift, lipo, you name it.  They said no, lol. I know this is hard and if you need to vent, give me a holler!",['tammyyyhubbard'],[],[],1,0,2,[],[],https://twitter.com/EyeVey/status/1163964433141522432,False,,0,,,,,,,"[{'user_id': '700232443', 'username': 'EyeVey'}, {'user_id': '381893073', 'username': 'tammyyyhubbard'}]",
1163963437459939330,1163963437459939330,1566345483000,2019-08-20,18:58:03,CDT,517780507,mclm18,The Manang Lanie,,"What a day: mom had successful lumpectomy, had a dog pee at my feet and didn’t find out until I stepped in it, husband’s car acting crazy then he blew out a tire... I’m tired! #fuckcancer #puppies #statefarm",[],[],[],0,0,0,"['#fuckcancer', '#puppies', '#statefarm']",[],https://twitter.com/mclm18/status/1163963437459939330,False,,0,,,,,,,"[{'user_id': '517780507', 'username': 'mclm18'}]",
1163926183664377861,1163926183664377861,1566336601000,2019-08-20,16:30:01,CDT,221920678,ywcaaus,YWCA Australia,,"Registrations are now open for the Encore program in WA! 🏊  Encore is a free exercise program  for women who have experienced mastectomy, lumpectomy or breast reconstruction surgery. The program runs for two hours a week over eight weeks. Register today:  https://buff.ly/2P0FD8H  pic.twitter.com/BChyM7Wfzw",[],['https://buff.ly/2P0FD8H'],['https://pbs.twimg.com/media/ECcYsiVXsAE3Ow2.jpg'],0,0,1,[],[],https://twitter.com/YWCAAus/status/1163926183664377861,False,,0,,,,,,,"[{'user_id': '221920678', 'username': 'YWCAAus'}]",
1163919591526916096,1163919591526916096,1566335029000,2019-08-20,16:03:49,CDT,1171028083,donnaungerman,donna ungerman,,"@jwaismanMD still have constant ache/pain inside armpit where glands were removed during lumpectomy. It's been 13 years since surgery.  What do you recommend for treatment? Help, please! Donna Friedman donnaungermanfriedman@gmail.com",['jwaismanmd'],[],[],0,0,0,[],[],https://twitter.com/donnaungerman/status/1163919591526916096,False,,0,,,,,,,"[{'user_id': '1171028083', 'username': 'donnaungerman'}, {'user_id': '3180823015', 'username': 'jwaismanMD'}]",
1163915653914550273,1163915653914550273,1566334091000,2019-08-20,15:48:11,CDT,259496892,stephmykael,Steph,,My year so far Jan: breast and lymph node biopsies Feb: cancer diagnosis  Mar - June: Chemo April: root canal Aug 1: lumpectomy  Sun: my birthday  Mon: cancer free Today: toe nail surgically removed  Next Tues: ortho appt for my knee Next Wed: voluntarily being placed in a bubble,[],[],[],0,0,0,[],[],https://twitter.com/stephmykael/status/1163915653914550273,False,,0,,,,,,,"[{'user_id': '259496892', 'username': 'stephmykael'}]",
1163912354939199490,1163912354939199490,1566333304000,2019-08-20,15:35:04,CDT,708364762132914176,marginprobe,MarginProbe,,What advantages does MarginProbe offer over full cavity shavings? @drbethjfk of @jfkmedical explains #lumpectomy  http://bit.ly/2kpHYuR ,"['drbethjfk', 'jfkmedical']",['http://bit.ly/2kpHYuR'],[],0,0,1,['#lumpectomy'],[],https://twitter.com/MarginProbe/status/1163912354939199490,False,,0,,,,,,,"[{'user_id': '708364762132914176', 'username': 'MarginProbe'}, {'user_id': '47399250', 'username': 'drbethjfk'}, {'user_id': '89217686', 'username': 'jfkmedical'}]",
1163894128310026242,1163894128310026242,1566328958000,2019-08-20,14:22:38,CDT,979148695,towandatou,okc's kin,,@askjillian 8 month mammogram & ultrasound after lumpectomy last week; they just called—they found something again. I knew bc my breast has been hurting. I go to the doctor tomorrow. I stay positive!,['askjillian'],[],[],5,0,13,[],[],https://twitter.com/TowandaToU/status/1163894128310026242,False,,0,,,,,,,"[{'user_id': '979148695', 'username': 'TowandaToU'}, {'user_id': '33978449', 'username': 'askjillian'}]",
1163855222860443648,1163850981936791553,1566319683000,2019-08-20,11:48:03,CDT,142937787,drattai,Dr. Deanna Attai,,"I agree. Generally when considering active surveillance it's in low grade / grade I DCIS. Grade 3 still typically recommended to undergo standard therapy (surgery, radiation if lumpectomy), especially ER/PR- when we don't have the option for endocrine therapy #bcsm #bccww",['lindabirdd'],[],[],0,1,2,"['#bcsm', '#bccww']",[],https://twitter.com/DrAttai/status/1163855222860443648,False,,0,,,,,,,"[{'user_id': '142937787', 'username': 'DrAttai'}, {'user_id': '521304726', 'username': 'lindabirdd'}]",
1163842161365803009,1163842161365803009,1566316569000,2019-08-20,10:56:09,CDT,180543464,paige2psu,PagingDrPaige,,Excellent news! My mom's lymph nodes were clear. She will have a lumpectomy and radiation. Thanks for everyone's prayers and support!,[],[],[],3,0,25,[],[],https://twitter.com/Paige2psu/status/1163842161365803009,False,,0,,,,,,,"[{'user_id': '180543464', 'username': 'Paige2psu'}]",
1163835872674025476,1163834589208633344,1566315069000,2019-08-20,10:31:09,CDT,1095378749372203009,lanning_bruce,Bruce Lanning,,My wife had a lumpectomy a few years back followed by radiation treatment.  She called it 'beam on' because that's what the sign read when it was on. She's okay now but her mom has to start it soon! All the best to you.,['kristasunshine1'],[],[],0,0,1,[],[],https://twitter.com/lanning_bruce/status/1163835872674025476,False,,0,,,,,,,"[{'user_id': '1095378749372203009', 'username': 'lanning_bruce'}, {'user_id': '1067094936967892992', 'username': 'Kristasunshine1'}]",
1163834156138278913,1163834156138278913,1566314660000,2019-08-20,10:24:20,CDT,2180315039,dr_calloway,Dr Daniel Calloway,,Latissimus Dorsi Myocutaneous Flap in Immediate #BreastReconstruction after failed #Lumpectomy and #Radiation #BreastCancer #BreastRecon #PlasticSurgery #Reconstruction #Surgery #LDFlap #AutologousReconstruction  https://journals.lww.com/prsgo/Fulltext/2019/07000/Latissimus_Dorsi_Myocutaneous_Flap_in_Immediate.2.aspx …,[],['https://journals.lww.com/prsgo/Fulltext/2019/07000/Latissimus_Dorsi_Myocutaneous_Flap_in_Immediate.2.aspx'],[],0,0,0,"['#breastreconstruction', '#lumpectomy', '#radiation', '#breastcancer', '#breastrecon', '#plasticsurgery', '#reconstruction', '#surgery', '#ldflap', '#autologousreconstruction']",[],https://twitter.com/Dr_Calloway/status/1163834156138278913,False,,0,,,,,,,"[{'user_id': '2180315039', 'username': 'Dr_Calloway'}]",
1163817999490568192,1163817999490568192,1566310808000,2019-08-20,09:20:08,CDT,708364762132914176,marginprobe,MarginProbe,,Good news for women who are having #lumpectomy surgery. #beatcancer http://bit.ly/2hxlKCh ,[],['http://bit.ly/2hxlKCh'],[],0,0,1,"['#lumpectomy', '#beatcancer']",[],https://twitter.com/MarginProbe/status/1163817999490568192,False,,0,,,,,,,"[{'user_id': '708364762132914176', 'username': 'MarginProbe'}]",
1163781096603115521,1163733636677607424,1566302010000,2019-08-20,06:53:30,CDT,407599240,babybarracudess,babybarracudess,,When I had my lumpectomy they lit up my lymph nodes with ‘nuclear dye’ The next morning I peed the most exquisite shade of cerulean blue I have ever seen😂,['hotroodog'],[],[],1,0,1,[],[],https://twitter.com/Babybarracudess/status/1163781096603115521,False,,0,,,,,,,"[{'user_id': '407599240', 'username': 'Babybarracudess'}, {'user_id': '1142126256839954432', 'username': 'HotRooDog'}]",
1163774780996247553,1163774780996247553,1566300504000,2019-08-20,06:28:24,CDT,1067858711534809090,drchowdharymd,Mudit Chowdhary,,"Very interesting P2 breast cancer study in @Annals_Oncology from 🇮🇱  Typically, female BRCA carriers with early stage #breastcancer are recommended bilateral mastectomies  However, some prefer lumpectomy + #radiotherapy & contralateral observation due to side effect concerns  1/2",['annals_oncology'],[],[],2,3,13,"['#breastcancer', '#radiotherapy']",[],https://twitter.com/DrChowdharyMD/status/1163774780996247553,False,,0,,,,,,,"[{'user_id': '1067858711534809090', 'username': 'DrChowdharyMD'}, {'user_id': '44614314', 'username': 'Annals_Oncology'}]",
1163626035876941824,1163620063871717377,1566265040000,2019-08-19,20:37:20,CDT,6967032,itsmemaven,ItsMeMaven,,"Also 2 friends in the hospital today, and a third going for a lumpectomy later this week. My mind is on everyone close to me struggling this week.",['thegeorg'],[],[],1,0,0,[],[],https://twitter.com/ItsMeMaven/status/1163626035876941824,False,,0,,,,,,,"[{'user_id': '6967032', 'username': 'ItsMeMaven'}, {'user_id': '36171676', 'username': 'thegeorg'}]",
1163621784354246656,1163580019228184576,1566264027000,2019-08-19,20:20:27,CDT,719279280170123268,artandtheology,Victoria Emily Jones,,"Anya Silver's breast cancer poems (""Ash Wednesday"" ""Second Advent""…) & Lucille Clifton's (""amazons"" ""lumpectomy eve""). ""The Priesthood of Pediatric Heart Surgeons,"" Amit Majmudar; ""All Other Ground Is Sinking Sand,"" Ashley McHugh; ""Poem w/ a Phrase from George Herbert,"" B Foster",['markgwagenaar'],[],[],1,0,3,[],[],https://twitter.com/artandtheology/status/1163621784354246656,False,,0,,,,,,,"[{'user_id': '719279280170123268', 'username': 'artandtheology'}, {'user_id': '566757951', 'username': 'MarkGWagenaar'}]",
1163586030492160001,1163586030492160001,1566255502000,2019-08-19,17:58:22,CDT,708847416330625024,mrs_draggg,Bethany,,Moms surgery went great. Results came back negative in lymph nodes so just the lumpectomy and she’s good! Doc said “uneventful “ and that’s her fave kind! Another half hour in recovery and then we get to see her. ♥️♥️ @Draggg_,['draggg_'],[],[],1,2,20,[],[],https://twitter.com/mrs_draggg/status/1163586030492160001,False,,0,,,,,,,"[{'user_id': '708847416330625024', 'username': 'mrs_draggg'}, {'user_id': '3031686404', 'username': 'Draggg_'}]",
1163563846344368133,1163563846344368133,1566250213000,2019-08-19,16:30:13,CDT,708364762132914176,marginprobe,MarginProbe,,Marginprobe's impact on oncoplastic #surgery. @DrHolmesLA #lumpectomy #breastcancer #beatcancer http://bit.ly/2wJC9sM ,['drholmesla'],['http://bit.ly/2wJC9sM'],[],0,0,1,"['#surgery', '#lumpectomy', '#breastcancer', '#beatcancer']",[],https://twitter.com/MarginProbe/status/1163563846344368133,False,,0,,,,,,,"[{'user_id': '708364762132914176', 'username': 'MarginProbe'}, {'user_id': '199168967', 'username': 'DrHolmesLA'}]",
1163256490666409984,1163187566109003776,1566176934000,2019-08-18,20:08:54,CDT,3238012981,foxcarlyn,Carlyn Fox,,Caesarian section hysterectomy lumpectomy 2 laminectomies (spinal disk surgery) and I’m good😁,['tyler_casper'],[],[],0,0,0,[],[],https://twitter.com/FoxCarlyn/status/1163256490666409984,False,,0,,,,,,,"[{'user_id': '3238012981', 'username': 'FoxCarlyn'}, {'user_id': '232487911', 'username': 'tyler_casper'}]",
1163244459523375105,1163244459523375105,1566174065000,2019-08-18,19:21:05,CDT,1664222006,healthproradio,Health Radio Online,,The latest technological advances in lumpectomy procedures Read more:  https://bit.ly/2Mp2sR8  #LumpectomyProcedure #3DTomography #Tomography pic.twitter.com/u3O5fw8Cef,[],['https://bit.ly/2Mp2sR8'],['https://pbs.twimg.com/media/ECSsquIU0AA5UUn.jpg'],0,0,0,"['#lumpectomyprocedure', '#3dtomography', '#tomography']",[],https://twitter.com/HealthProRadio/status/1163244459523375105,False,,0,,,,,,,"[{'user_id': '1664222006', 'username': 'HealthProRadio'}]",
1163203549880377346,1161171682595352576,1566164312000,2019-08-18,16:38:32,CDT,1347708769,suewsheehan,Sue Sheehan,,"Well done I have just been through the same journey.  Sorry we haven't messaged your earlier but only recently found out.  I was diagnosed with breast cancer 12 months ago so had 6 Chemo, Lumpectomy and lymph nodes removed and 15 sessions of radiotherapy.  Sue, Tony, Lee Sheehan","['nicolahodkinson', 'thechristienhs']",[],[],0,0,0,[],[],https://twitter.com/suewsheehan/status/1163203549880377346,False,,0,,,,,,,"[{'user_id': '1347708769', 'username': 'suewsheehan'}, {'user_id': '412269237', 'username': 'NicolaHodkinson'}, {'user_id': '437421261', 'username': 'TheChristieNHS'}]",
1163199945706487809,1163187566109003776,1566163452000,2019-08-18,16:24:12,CDT,2320382456,meyerlisa1983,lisa marie meyer mitchell (Astrid)💕🇺🇸🇺🇸MAGA,,God Bless you! I had lumpectomy in 2013 stage 1 est/prog + hugs survivor sister! 🙏🏻💕💕,"['jenawharrisjena', 'tyler_casper']",[],[],2,1,13,[],[],https://twitter.com/meyerlisa1983/status/1163199945706487809,False,,0,,,,,,,"[{'user_id': '2320382456', 'username': 'meyerlisa1983'}, {'user_id': '710891246', 'username': 'JenawharrisJena'}, {'user_id': '232487911', 'username': 'tyler_casper'}]",
1163190305614716930,1163187566109003776,1566161154000,2019-08-18,15:45:54,CDT,710891246,jenawharrisjena,Jena Harris,,"I had a lumpectomy and lymph node dissection in 2015; stage 1 breast cancer, HER2/NU positive; but I’m all good now 🙏🙏🙏",['tyler_casper'],[],[],2,1,28,[],[],https://twitter.com/JenawharrisJena/status/1163190305614716930,False,,0,,,,,,,"[{'user_id': '710891246', 'username': 'JenawharrisJena'}, {'user_id': '232487911', 'username': 'tyler_casper'}]",
1163188390893740032,1163149795524931584,1566160698000,2019-08-18,15:38:18,CDT,986113877564735488,pinkribbonroad,Pink Ribbon Road,,"I had a lumpectomy with reconstruction with lymph node dissection on my rt side. We found affected mediastinal nodes just before radiation, so I got 7.5 wks of radiation to my entire rt chest+Cisplatin.",['fitwithjanice'],[],[],1,0,0,[],[],https://twitter.com/PinkRibbonRoad/status/1163188390893740032,False,,0,,,,,,,"[{'user_id': '986113877564735488', 'username': 'PinkRibbonRoad'}, {'user_id': '120563676', 'username': 'fitwithjanice'}]",
1163145330432589824,1163145328973008897,1566150431000,2019-08-18,12:47:11,CDT,2910424174,sabinbmotwanimd,Sabin Motwani,,3. Cosmetic Outcome from Post Lumpectomy Whole Breast Irradiation (WBI) Versus Partial Breast Irradiation (PBI) on the @NRGonc /@NSABPFoundation  B39-RTOG 0413 Ph3 RCT Presented by Julia White @OSUCCC_James  Discussant @mylintorres @WinshipAtEmory #radonc #bcsm,"['nrgonc', 'nsabpfoundation', 'osuccc_james', 'mylintorres', 'winshipatemory']",[],[],1,4,10,"['#radonc', '#bcsm']",[],https://twitter.com/sabinbmotwanimd/status/1163145330432589824,False,,0,,,,,,,"[{'user_id': '2910424174', 'username': 'sabinbmotwanimd'}, {'user_id': '2210559318', 'username': 'NRGonc'}, {'user_id': '823966944390942720', 'username': 'NSABPFoundation'}, {'user_id': '34295436', 'username': 'OSUCCC_James'}, {'user_id': '956879590835785731', 'username': 'MylinTorres'}, {'user_id': '154590922', 'username': 'WinshipAtEmory'}]",
1163124759644856321,1163123537462398976,1566145527000,2019-08-18,11:25:27,CDT,2354500304,knitknockersuk,Knitted Knockers UK,,#mastectomy #lumpectomy #breastprosthesis #breastcancer #flatfriends,[],[],[],0,0,2,"['#mastectomy', '#lumpectomy', '#breastprosthesis', '#breastcancer', '#flatfriends']",[],https://twitter.com/KnitKnockersUK/status/1163124759644856321,False,,0,,,,,,,"[{'user_id': '2354500304', 'username': 'KnitKnockersUK'}]",
1162789024110665730,1162789022948823040,1566065481000,2019-08-17,13:11:21,CDT,791667952969916417,rrwalker731,Richelle Walker,,Update: Yall prayed hard for Robin ( Canadian service women with breast cancer) during her lumpectomy..the hard part has begun ..cancer was found in her lymph nodes and is now stage 2 ..6 months of chemo 5 weeks of 5 days per week of radiation keep praying please,[],[],[],0,0,0,[],[],https://twitter.com/rrwalker731/status/1162789024110665730,False,,0,,,,,,,"[{'user_id': '791667952969916417', 'username': 'rrwalker731'}]",
1162771460944998403,1162768564035751937,1566061294000,2019-08-17,12:01:34,CDT,382381532,nofacebookforme,Sue - JustTryingToMatter (don't put me on trains),,"Single parent since daughter's birth. Diagnosed w/breast cancer 9 months later. Had to wean her before lumpectomy. Diagnosed w/it again when she began kindergarten. Bi-lateral mastectomy. Those were easy years. You have education, good salary & sense of humor. You'll be fine. :)",['drshayphd'],[],[],0,0,1,[],[],https://twitter.com/NoFacebookForMe/status/1162771460944998403,False,,0,,,,,,,"[{'user_id': '382381532', 'username': 'NoFacebookForMe'}, {'user_id': '24333130', 'username': 'DrShayPhD'}]",
1162748166342623232,1162748166342623232,1566055740000,2019-08-17,10:29:00,CDT,986796257799630848,breast_aug_la,Breast Augmentation,,Will I Need Breast Reconstruction After a Lumpectomy?  https://bloggingforbreastcare.com/2019/04/will-i-need-breast-reconstruction-after-a-lumpectomy/?utm_source=twitter&utm_term=breast_aug …,[],['https://bloggingforbreastcare.com/2019/04/will-i-need-breast-reconstruction-after-a-lumpectomy/?utm_source=twitter&utm_term=breast_aug'],[],0,0,0,[],[],https://twitter.com/breast_aug_la/status/1162748166342623232,False,,0,,,,,,,"[{'user_id': '986796257799630848', 'username': 'breast_aug_la'}]",
1162653088274165760,1162284058509922304,1566033071000,2019-08-17,04:11:11,CDT,126580041,kkattieeekat,katherine brindley,,"I have a mammogram every year too simply because a lump was found on my regular yearly one . Lumpectomy and 14 radiotherapy treatments later the litter fucker was zapped .just had this years mammogram,still fucking zapped !","['chrissie_c', 'emmakennedy']",[],[],1,0,2,[],[],https://twitter.com/kkattieeekat/status/1162653088274165760,False,,0,,,,,,,"[{'user_id': '126580041', 'username': 'kkattieeekat'}, {'user_id': '5520822', 'username': 'Chrissie_c'}, {'user_id': '23217907', 'username': 'EmmaKennedy'}]",
