id,conversation_id,created_at,date,time,timezone,user_id,username,name,place,tweet,mentions,urls,photos,replies_count,retweets_count,likes_count,hashtags,cashtags,link,retweet,quote_url,video,near,geo,source,user_rt_id,user_rt,retweet_id,reply_to,retweet_date
1164169365815738370,1164169365815738370,1566394580000,2019-08-21,08:36:20,CDT,1107714315044433920,doctorhealthed1,doctorhealtheducation,,". A mastectomy is usually carried out to treat breast cancer. In some cases, people believed to be at high risk of breast cancer have the operation as a preventative measure. Video Credit: learndoctor  https://www.instagram.com/p/B1bYe1Knj4K/?igshid=9dimwr04z3u7 …",[],['https://www.instagram.com/p/B1bYe1Knj4K/?igshid=9dimwr04z3u7'],[],0,0,1,[],[],https://twitter.com/doctorhealthed1/status/1164169365815738370,False,,0,,,,,,,"[{'user_id': '1107714315044433920', 'username': 'doctorhealthed1'}]",
1164161703397007361,1164061569036107776,1566392753000,2019-08-21,08:05:53,CDT,1144085508391231488,rahardplace,Rock&aHardPlace,,"""When we see a spike in kids hurting themselves""  Have you consulted the latest stats on teen FtM binding (self-harm), cross-sex hormone injecting (self-harm), cosmetic double mastectomy (self-harm)?","['jonwestenberg', 'bernard_lane', 'australian', 'bmj_latest', 'satpaper']",[],[],0,0,0,[],[],https://twitter.com/RAhardplace/status/1164161703397007361,False,,0,,,,,,,"[{'user_id': '1144085508391231488', 'username': 'RAhardplace'}, {'user_id': '16836943', 'username': 'Jonwestenberg'}, {'user_id': '189041644', 'username': 'Bernard_Lane'}, {'user_id': '9609632', 'username': 'australian'}, {'user_id': '16949344', 'username': 'bmj_latest'}, {'user_id': '1967889907', 'username': 'SatPaper'}]",
1164161555887480832,1164161555887480832,1566392718000,2019-08-21,08:05:18,CDT,390969053,clairecollison1,claire collison,,"Securing a citation for 70% of women not choosing reconstructive surgery, I uncovered this 2008 stat I've never seen before '47.1% of women experienced mild or moderate to strong regret over their decision to have reconstructive surgery'. Almost half! #unreconstructed #mastectomy",[],[],[],1,1,5,"['#unreconstructed', '#mastectomy']",[],https://twitter.com/clairecollison1/status/1164161555887480832,False,,0,,,,,,,"[{'user_id': '390969053', 'username': 'clairecollison1'}]",
1164160690883444738,1164155887302217728,1566392512000,2019-08-21,08:01:52,CDT,44068188,ellekazham,Elle @ angst-er in rehab (not),,Uh there's this thing called mastectomy....?,['paradxse_lost'],[],[],1,0,0,[],[],https://twitter.com/Ellekazham/status/1164160690883444738,False,,0,,,,,,,"[{'user_id': '44068188', 'username': 'Ellekazham'}, {'user_id': '1020701817783455746', 'username': 'paradxse_lost'}]",
1164157915084644353,1164157915084644353,1566391850000,2019-08-21,07:50:50,CDT,107430967,monachollet,Mona Chollet,,Reconciling With My Body After a Mastectomy  https://www.thecut.com/2019/08/how-my-body-and-i-reconciled-after-a-mastectomy.html …,[],['https://www.thecut.com/2019/08/how-my-body-and-i-reconciled-after-a-mastectomy.html'],[],0,2,10,[],[],https://twitter.com/monachollet/status/1164157915084644353,False,,0,,,,,,,"[{'user_id': '107430967', 'username': 'monachollet'}]",
1164154071441444864,1164154071441444864,1566390934000,2019-08-21,07:35:34,CDT,940463448823132160,aethernets,🏁aeth🏁,,"mario's not wearing a binder, he had a mastectomy like years ago at this point  https://twitter.com/aethernets/status/1164054277251371009 …",[],['https://twitter.com/aethernets/status/1164054277251371009'],[],0,0,3,[],[],https://twitter.com/aethernets/status/1164154071441444864,False,https://twitter.com/aethernets/status/1164054277251371009,0,,,,,,,"[{'user_id': '940463448823132160', 'username': 'aethernets'}]",
1164148689134346244,1164148689134346244,1566389650000,2019-08-21,07:14:10,CDT,1106240033500090368,brc_un,UnBRCAbleBoutique,,"Calling all ladies....on September 21 from 10am - 12noon, Tracy Milgram from #BRCASTRONG will be doing bra fittings.  This is for women post mastectomy/reconstruction who have no idea what their current size is.…  https://www.instagram.com/p/B1bPZKvg4ZE/?igshid=dvkdgpknmatu …",[],['https://www.instagram.com/p/B1bPZKvg4ZE/?igshid=dvkdgpknmatu'],[],0,0,0,['#brcastrong'],[],https://twitter.com/brc_un/status/1164148689134346244,False,,0,,,,,,,"[{'user_id': '1106240033500090368', 'username': 'brc_un'}]",
1164148338138079233,1164148338138079233,1566389567000,2019-08-21,07:12:47,CDT,1011779337878691840,tracy67462263,BRCAStrong,,"Calling all ladies....on September 21 from 10am - 12noon, Tracy Milgram from #BRCASTRONG will be doing bra fittings.  This is for women post mastectomy/reconstruction who have no idea what their current size is.…  https://www.instagram.com/p/B1bPOy6A9m1/?igshid=1r4micp9utpu8 …",[],['https://www.instagram.com/p/B1bPOy6A9m1/?igshid=1r4micp9utpu8'],[],0,0,1,['#brcastrong'],[],https://twitter.com/Tracy67462263/status/1164148338138079233,False,,0,,,,,,,"[{'user_id': '1011779337878691840', 'username': 'Tracy67462263'}]",
1164148124547502081,1164148124547502081,1566389516000,2019-08-21,07:11:56,CDT,115427314,erinmcgeeferrel,Erin McGee Ferrell,,Guess what just arrived!!!! Ms.Mastectomy Kit 1.  http://PirateCrewPaperDolls.com  Breast Cancer Educational Tool — at Erin McGee Ferrell Studio  https://www.facebook.com/1274278059/posts/10219045916360207/ …,[],"['http://PirateCrewPaperDolls.com', 'https://www.facebook.com/1274278059/posts/10219045916360207/']",[],0,0,1,[],[],https://twitter.com/ErinMcGeeFerrel/status/1164148124547502081,False,,0,,,,,,,"[{'user_id': '115427314', 'username': 'ErinMcGeeFerrel'}]",
1164145037212573696,1164136062073167873,1566388780000,2019-08-21,06:59:40,CDT,2878193493,maeltar,Simon (sparks) Parkes,,"Yep, please do it, my wife has had a double mastectomy as didn't catch it in time..","['wolvespremier', 'wolves_society']",[],[],0,1,4,[],[],https://twitter.com/maeltar/status/1164145037212573696,False,,0,,,,,,,"[{'user_id': '2878193493', 'username': 'maeltar'}, {'user_id': '58897530', 'username': 'wolvespremier'}, {'user_id': '910212607759585281', 'username': 'wolves_society'}]",
1164138289571540992,1164138289571540992,1566387171000,2019-08-21,06:32:51,CDT,488463165,helenremi411,Helen,,"Trying to motivate myself to get dressed after my #mastectomy surgery last week I have an appointment with @marksandspencer I’m just dreading it, hopefully it will make me feel a bit more like myself #IWantToFeelPretty #breastcancer #Cancer #ToYoung",['marksandspencer'],[],[],1,0,0,"['#mastectomy', '#iwanttofeelpretty', '#breastcancer', '#cancer', '#toyoung']",[],https://twitter.com/HelenRemi411/status/1164138289571540992,False,,0,,,,,,,"[{'user_id': '488463165', 'username': 'HelenRemi411'}, {'user_id': '37916167', 'username': 'marksandspencer'}]",
1164137847336648704,1164137847336648704,1566387066000,2019-08-21,06:31:06,CDT,392795104,alyssajoy71,Alyssa Joy,,"Today marks 4 years since my mastectomy. I can’t describe the roller coaster of emotions as time passes. Never complacency, often worried, but mostly grateful for each day I’m cancer-free and hopeful it stays that way. #researchsaveslives #bcsm",[],[],[],2,0,14,"['#researchsaveslives', '#bcsm']",[],https://twitter.com/AlyssaJoy71/status/1164137847336648704,False,,0,,,,,,,"[{'user_id': '392795104', 'username': 'AlyssaJoy71'}]",
1164122105773985793,1164121953118150656,1566383313000,2019-08-21,05:28:33,CDT,1146785868046315521,cacfcarolatu617,CAROL ATUHIRWE CANCER FOUNDATION,,"More recently, there has been a movement toward less extensive operations to treat cancer. For example, a generation ago, women with breast cancer were treated with radical mastectomy.",[],[],[],1,0,2,[],[],https://twitter.com/CACFcarolatu617/status/1164122105773985793,False,,0,,,,,,,"[{'user_id': '1146785868046315521', 'username': 'CACFcarolatu617'}]",
1164111576846102528,1164111576846102528,1566380802000,2019-08-21,04:46:42,CDT,46831734,colleen_benn,☘️Feisty Redhead☘️🆘,,"Did You Know That Jane Fonda, 81, Has Had a Double Mastectomy and Cancer In Her Mouth? Amazing Resilience as She Mourns Her Brother Peter Fonda’s Death From Cancer #SmartNews https://www.survivornet.com/articles/did-you-know-that-jane-fonda-81-has-had-a-double-mastectomy-and-cancer-in-her-mouth-amazing-resilience-as-she-mourns-her-brother-peter-fondas-death-from-cancer/ …",[],['https://www.survivornet.com/articles/did-you-know-that-jane-fonda-81-has-had-a-double-mastectomy-and-cancer-in-her-mouth-amazing-resilience-as-she-mourns-her-brother-peter-fondas-death-from-cancer/'],[],0,0,1,['#smartnews'],[],https://twitter.com/colleen_benn/status/1164111576846102528,False,,0,,,,,,,"[{'user_id': '46831734', 'username': 'colleen_benn'}]",
1164110434384977920,1164110434384977920,1566380530000,2019-08-21,04:42:10,CDT,1476742116,personalfitnes3,PersonalFitness3🏃,,Chronicles of Courage: Life After a Preventative Double Mastectomy  https://www.livestrong.com/article/13715314-chronicles-of-courage-life-after-my-preventative-double-mastectomy/ …,[],['https://www.livestrong.com/article/13715314-chronicles-of-courage-life-after-my-preventative-double-mastectomy/'],[],0,0,0,[],[],https://twitter.com/personalfitnes3/status/1164110434384977920,False,,0,,,,,,,"[{'user_id': '1476742116', 'username': 'personalfitnes3'}]",
1164110271843119104,1164110271843119104,1566380491000,2019-08-21,04:41:31,CDT,878368578554167296,mlewisleary,Merriam Lewis-Leary,,"How am physically healthy, I don't think about having a hysterectomy, a mastectomy, massive hair before middle age.",[],[],[],0,0,0,[],[],https://twitter.com/mlewisleary/status/1164110271843119104,False,,0,,,,,,,"[{'user_id': '878368578554167296', 'username': 'mlewisleary'}]",
1164106604872130560,1164087970028302336,1566379617000,2019-08-21,04:26:57,CDT,798534662998159361,dancinginshado,Tashmia_Owen,,As someone who is attending a surgical prep morning for my upcoming mastectomy this thread is hugely appreciated.,['rachelmoss_'],[],[],1,0,17,[],[],https://twitter.com/dancinginshado/status/1164106604872130560,False,,0,,,,,,,"[{'user_id': '798534662998159361', 'username': 'dancinginshado'}, {'user_id': '911118156', 'username': 'rachelmoss_'}]",
1164092661713604609,1164092661713604609,1566376293000,2019-08-21,03:31:33,CDT,712947377909313536,cancers_mdpi,Cancers MDPI,,"Mastectomy or Breast-Conserving Therapy for Early #BreastCancer in Real-Life Clinical Practice: Outcome Comparison of 7565 Cases:  patients receive BCS with radiotherapy rather than mastectomy, whenever it is medically feasible and appropriate. See more at  https://www.mdpi.com/2072-6694/11/2/160 …",[],['https://www.mdpi.com/2072-6694/11/2/160'],[],0,0,1,['#breastcancer'],[],https://twitter.com/Cancers_MDPI/status/1164092661713604609,False,,0,,,,,,,"[{'user_id': '712947377909313536', 'username': 'Cancers_MDPI'}]",
1164089313069416448,1164024298987634688,1566375494000,2019-08-21,03:18:14,CDT,1143716305440145408,billablepoetry,Kathryn Elizabeth,,"Here's a shirt I bought recently. What I like is, there are mastectomy scars and breast pumps and not-transitioned breasts. Inclusive af.  pic.twitter.com/TpWy8nAZPM",['thesaurosie'],[],['https://pbs.twimg.com/media/ECetDo3VUAAyhtV.jpg'],1,0,1,[],[],https://twitter.com/BillablePoetry/status/1164089313069416448,False,,0,,,,,,,"[{'user_id': '1143716305440145408', 'username': 'BillablePoetry'}, {'user_id': '6518922', 'username': 'thesaurosie'}]",
